{
  "schema_version": "1.0.0",
  "revision_id": "SYN-REV-AMBIG",
  "outcome": "NEEDS_CLARIFICATION",
  "candidate_race_ids": [
    "20000101-01-01",
    "20000101-01-02"
  ],
  "created_at": "2000-01-01T10:20:00+09:00",
  "explanation": {
    "summary": "SYNTHETIC: race not stated; asking user"
  },
  "synthetic": true
}
