{
  "schema_version": "1.0.0",
  "revision_id": "SYN-REV-1",
  "outcome": "RETAINED",
  "race_id": "20000101-01-01",
  "baseline": {
    "prediction_id": "SYN-PRED-V11-PRE",
    "prediction_sha256": "7d47c566128186cc519bb9d76b576cc70f25eca145d6d274fdc9a9a5f597d67b"
  },
  "created_at": "2000-01-01T10:20:00+09:00",
  "exhibition_observations": [
    {
      "field": "exhibition_time",
      "boat": 1,
      "value": 6.95,
      "raw": "SYNTHETIC 1号艇 6.95",
      "source": "SYNTHETIC user post"
    },
    {
      "field": "exhibition_st",
      "boat": 1,
      "value": 0.15,
      "source": "SYNTHETIC user post"
    }
  ],
  "changes": {
    "added": [],
    "removed": [],
    "units_changed": []
  },
  "synthetic": true,
  "explanation": {
    "summary": "SYNTHETIC: exhibition adds no material change",
    "unchanged": "SYNTHETIC: combinations and units unchanged"
  }
}
